{
  "connector_version": "UAC-1.0.0",
  "request_id": "req-20260216-0001",
  "timestamp_utc": "2026-02-16T23:40:00Z",
  "source_model": {
    "provider": "openai",
    "model_id": "gpt-5",
    "model_version": "2026-02",
    "deployment_scope": "production",
    "auth_context": {
      "actor_id": "scribe-operator-01",
      "tenant_id": "federal-demo",
      "role": "auditor"
    }
  },
  "proposed_action": {
    "action_type": "inference",
    "domain": "finance",
    "claim": "Revenue recognition policy is ASC-606 compliant.",
    "utility_phi": 0.82,
    "requires_execution": false,
    "payload": {
      "module": "ao-audit-engine"
    }
  },
  "constraint_context": {
    "invariants": [
      "if rank(J) < dim(theta) then inference is non-identifiable",
      "if lambda == 0 then admissibility_delta == 0"
    ],
    "expected_parameter_dim": 2,
    "jacobian_rank": 2,
    "evidence": [
      {
        "evidence_id": "e1",
        "type": "document",
        "source_uri": "https://docs.example.com/rev-policy",
        "hash_sha256": "aaaaaaaaaaaaaaaaaaaaaaaaaaaaaaaaaaaaaaaaaaaaaaaaaaaaaaaaaaaaaaaa",
        "confidence": 0.9,
        "timestamp_utc": "2026-02-16T23:20:00Z"
      },
      {
        "evidence_id": "e2",
        "type": "document",
        "source_uri": "https://sec.gov/filing/000000001",
        "hash_sha256": "bbbbbbbbbbbbbbbbbbbbbbbbbbbbbbbbbbbbbbbbbbbbbbbbbbbbbbbbbbbbbbbb",
        "confidence": 0.85,
        "timestamp_utc": "2026-02-16T23:21:00Z"
      }
    ],
    "thresholds": {
      "min_identifiability_rank": 2,
      "min_evidence_count": 2,
      "max_policy_risk": 0.2,
      "min_integrity_lambda": 0.8
    },
    "policy_tags": ["federal", "unbiased-ai"]
  },
  "observability": {
    "sensor_resolution": 1.0,
    "signal_domain": 1.0,
    "coupling_omega": 1.0
  },
  "audit_preferences": {
    "strict_refusal_on_underdetermined": true,
    "include_step_trace": true,
    "return_remediation": true
  }
}
